{
  "object": "evo.run",
  "schema_version": "2.0",
  "evo_version": "1.0.0",
  "run_id": "out_1",
  "started_at": "2026-09-15T20:00:00Z",
  "finished_at": "2026-09-15T20:00:02.147Z",
  "duration_ms": 2147,
  "mode": "dry_run",
  "outcome": "succeeded",
  "exit_code": 0,
  "data": {
    "collections": [],
    "tasks": [],
    "facts": [],
    "problems": [],
    "effects": [
      {
        "subject": "repo",
        "status": "planned",
        "verb": "delete",
        "quantity": 3,
        "object": "stale tag"
      }
    ],
    "actions": []
  }
}
